{
  "contract": "io.clayz.presentation.layout-contract-resolution/1.0",
  "resolution_id": "layout-resolution-6a85fc653c04a8ae998a",
  "request_id": "synthetic-layout-comparison",
  "status": "selected",
  "retrieval_receipt_id": "receipt-9ca9be03d1fe9f388242",
  "selected_layout_contract": {
    "record_id": "layout.evidence-with-implication",
    "provider_id": "builtin-catalog",
    "payload_ref": "catalog/layout-contracts/evidence-with-implication.json",
    "source_sha256": "5afc88e675624d67b37cf77dc785385fadc08544906b7093708cdf29611a371c"
  },
  "fallback": {
    "used": false,
    "reason": "",
    "next_action": ""
  },
  "guards": {
    "only_registered_records": true,
    "only_receipt_candidates_selected": true,
    "no_invented_layout_contracts": true,
    "theme_not_selected_here": true,
    "visual_variant_not_selected_here": true
  }
}
